{
  "schema": "originplot.capabilities.v6",
  "origin_version": "2026",
  "compatibility": "experimental",
  "authorization": {
    "origin_worker": "administrator_required",
    "release_controller": "administrator_required",
    "policy_changed_in_v6": false
  },
  "compile_primitives": [
    "line",
    "scatter",
    "line_scatter",
    "errorbar",
    "bar",
    "grouped_bar",
    "stacked_bar",
    "heatmap",
    "contour",
    "multi_panel"
  ],
  "live_evidence_primitives": [],
  "live_blocked": {
    "heatmap": "regular_grid_adapter_not_live_verified"
  },
  "verification": {
    "machine_smoke_required": true,
    "same_run_save_reopen_readback_export_required": true,
    "general_release_fail_closed_without_promoted_live_evidence": true
  },
  "note": "Origin 2026 remains experimental; no live primitive is promoted by this metadata."
}
